{
  "$schema": "https://json-schema.org/draft/2020-12/schema",
  "$id": "https://ronomepo.dev/schemas/repo-manifest.schema.json",
  "title": "Ronomepo Repo Manifest",
  "description": "Versioned manifest for a managed repository exposed to Ronomepo and agents.",
  "type": "object",
  "additionalProperties": false,
  "required": [
    "schema_version",
    "items"
  ],
  "properties": {
    "schema_version": {
      "type": "integer",
      "enum": [
        1,
        2
      ],
      "description": "Manifest schema version. Version 2 adds repo-defined actions and capability declarations; version 1 remains accepted for compatibility."
    },
    "repo_id": {
      "type": "string",
      "minLength": 1,
      "description": "Optional stable logical identifier for the repository."
    },
    "items": {
      "type": "array",
      "description": "Typed work units that Ronomepo can operate on.",
      "items": {
        "$ref": "#/$defs/item"
      }
    },
    "actions": {
      "type": "array",
      "description": "Schema v2 repo-defined executable action nodes.",
      "default": [],
      "items": {
        "$ref": "#/$defs/repo_action_definition"
      }
    },
    "capabilities": {
      "type": "array",
      "description": "Schema v2 capability declarations implemented, not applicable, or unsupported by repo nodes.",
      "default": [],
      "items": {
        "$ref": "#/$defs/capability_declaration"
      }
    },
    "repo_actions": {
      "type": "array",
      "description": "Legacy explicit repo-level commands for standardized actions.",
      "default": [],
      "items": {
        "$ref": "#/$defs/action_command"
      }
    },
    "aggregation": {
      "type": "array",
      "description": "Explicit repo-level action planning for actions spanning multiple items.",
      "default": [],
      "items": {
        "$ref": "#/$defs/action_aggregation"
      }
    }
  },
  "$defs": {
    "node_id": {
      "type": "string",
      "minLength": 1,
      "pattern": "^(?!/)(?!.*//)(?!.*(?:^|/)\\.\\.?(?:/|$)).*[^/]$"
    },
    "standard_action": {
      "type": "string",
      "enum": [
        "list_artifacts",
        "build",
        "test",
        "clean",
        "verify_dependencies_freshness",
        "deploy"
      ]
    },
    "standard_action_ref_name": {
      "type": "string",
      "pattern": "^(cargo|node|python|gradle|gradle_android)\\.(list_artifacts|build|test|tests|clean|verify_dependencies_freshness|dependencies_outdated|deploy)$"
    },
    "output_mode": {
      "type": "string",
      "enum": [
        "text",
        "json",
        "json_lines"
      ],
      "default": "text"
    },
    "execution_mode": {
      "type": "string",
      "enum": [
        "sequential",
        "parallel"
      ],
      "default": "sequential"
    },
    "failure_policy": {
      "type": "string",
      "enum": [
        "fail_fast",
        "continue"
      ],
      "default": "fail_fast"
    },
    "merge_strategy": {
      "type": "string",
      "enum": [
        "combined",
        "per_item"
      ],
      "default": "combined"
    },
    "relative_or_absolute_path": {
      "type": "string",
      "minLength": 1
    },
    "env": {
      "type": "object",
      "description": "Environment variables for the command.",
      "default": {},
      "additionalProperties": {
        "type": "string"
      }
    },
    "argv": {
      "type": "array",
      "minItems": 1,
      "items": {
        "type": "string",
        "minLength": 1
      },
      "description": "argv-style command. The first item is the program."
    },
    "artifact": {
      "type": "object",
      "additionalProperties": false,
      "required": [
        "name",
        "kind"
      ],
      "properties": {
        "name": {
          "type": "string",
          "minLength": 1
        },
        "kind": {
          "type": "string",
          "minLength": 1
        },
        "path": {
          "$ref": "#/$defs/relative_or_absolute_path",
          "description": "Concrete artifact path relative to the item root unless absolute."
        },
        "pattern": {
          "type": "string",
          "minLength": 1,
          "description": "Glob-like pattern for one or more artifacts relative to the item root."
        },
        "build_action": {
          "$ref": "#/$defs/standard_action"
        }
      },
      "anyOf": [
        {
          "required": [
            "path"
          ]
        },
        {
          "required": [
            "pattern"
          ]
        }
      ]
    },
    "action_command": {
      "type": "object",
      "additionalProperties": false,
      "required": [
        "action",
        "command"
      ],
      "properties": {
        "action": {
          "$ref": "#/$defs/standard_action"
        },
        "command": {
          "$ref": "#/$defs/argv"
        },
        "workdir": {
          "$ref": "#/$defs/relative_or_absolute_path",
          "description": "Working directory relative to the item or repo root."
        },
        "env": {
          "$ref": "#/$defs/env"
        },
        "timeout_seconds": {
          "type": "integer",
          "minimum": 1
        },
        "output": {
          "$ref": "#/$defs/output_mode"
        }
      }
    },
    "repo_action_definition": {
      "type": "object",
      "additionalProperties": false,
      "required": [
        "id",
        "command"
      ],
      "properties": {
        "id": {
          "$ref": "#/$defs/node_id"
        },
        "command": {
          "$ref": "#/$defs/argv"
        },
        "workdir": {
          "$ref": "#/$defs/relative_or_absolute_path",
          "description": "Working directory relative to the repository root unless absolute."
        },
        "env": {
          "$ref": "#/$defs/env"
        },
        "timeout_seconds": {
          "type": "integer",
          "minimum": 1
        },
        "output": {
          "$ref": "#/$defs/output_mode"
        }
      }
    },
    "action_ref": {
      "oneOf": [
        {
          "type": "object",
          "additionalProperties": false,
          "required": [
            "kind",
            "name"
          ],
          "properties": {
            "kind": {
              "const": "standard"
            },
            "name": {
              "$ref": "#/$defs/standard_action_ref_name"
            },
            "item_id": {
              "type": "string",
              "minLength": 1
            },
            "root": {
              "$ref": "#/$defs/relative_or_absolute_path"
            }
          }
        },
        {
          "type": "object",
          "additionalProperties": false,
          "required": [
            "kind",
            "id"
          ],
          "properties": {
            "kind": {
              "const": "repo_action"
            },
            "id": {
              "$ref": "#/$defs/node_id"
            }
          }
        },
        {
          "type": "object",
          "additionalProperties": false,
          "required": [
            "kind",
            "items"
          ],
          "properties": {
            "kind": {
              "const": "group"
            },
            "execution": {
              "$ref": "#/$defs/execution_mode"
            },
            "failure_policy": {
              "$ref": "#/$defs/failure_policy"
            },
            "merge": {
              "$ref": "#/$defs/merge_strategy"
            },
            "items": {
              "type": "array",
              "minItems": 1,
              "items": {
                "$ref": "#/$defs/action_ref"
              }
            }
          }
        }
      ]
    },
    "capability_declaration": {
      "type": "object",
      "additionalProperties": false,
      "required": [
        "id",
        "capability",
        "status"
      ],
      "properties": {
        "id": {
          "$ref": "#/$defs/node_id"
        },
        "capability": {
          "type": "string",
          "minLength": 1,
          "description": "Catalog capability id, for example integrity.build or dependencies.outdated."
        },
        "status": {
          "type": "string",
          "enum": [
            "implemented",
            "not_applicable",
            "unsupported"
          ]
        },
        "item_id": {
          "type": "string",
          "minLength": 1
        },
        "root": {
          "$ref": "#/$defs/relative_or_absolute_path"
        },
        "action_ref": {
          "$ref": "#/$defs/action_ref"
        },
        "standard_action": {
          "$ref": "#/$defs/standard_action_ref_name"
        },
        "reason": {
          "type": "string",
          "minLength": 1
        },
        "schedule": {
          "description": "Optional scheduling policy used for manual due detection. Supported forms include manual, interval_seconds, and on_commit_change.",
          "oneOf": [
            {
              "type": "string",
              "enum": ["manual", "on_commit_change"]
            },
            {
              "type": "object",
              "additionalProperties": false,
              "properties": {
                "kind": {
                  "type": "string",
                  "enum": ["manual", "interval", "on_commit_change"]
                },
                "mode": {
                  "type": "string",
                  "enum": ["manual", "interval", "on_commit_change"]
                },
                "interval_seconds": {
                  "type": "integer",
                  "minimum": 1
                },
                "on_commit_change": {
                  "type": "boolean"
                }
              }
            }
          ]
        }
      }
    },
    "action_aggregation": {
      "type": "object",
      "additionalProperties": false,
      "required": [
        "action",
        "item_ids"
      ],
      "properties": {
        "action": {
          "$ref": "#/$defs/standard_action"
        },
        "item_ids": {
          "type": "array",
          "minItems": 1,
          "items": {
            "type": "string",
            "minLength": 1
          }
        },
        "execution": {
          "$ref": "#/$defs/execution_mode"
        },
        "failure_policy": {
          "$ref": "#/$defs/failure_policy"
        },
        "merge": {
          "$ref": "#/$defs/merge_strategy"
        }
      }
    },
    "item": {
      "type": "object",
      "additionalProperties": false,
      "required": [
        "id",
        "type",
        "path"
      ],
      "properties": {
        "id": {
          "$ref": "#/$defs/node_id"
        },
        "type": {
          "type": "string",
          "minLength": 1,
          "description": "Ronomepo handler type, for example cargo or python."
        },
        "path": {
          "$ref": "#/$defs/relative_or_absolute_path",
          "description": "Item root relative to the repository root unless absolute."
        },
        "config": {
          "description": "Optional handler-specific configuration payload."
        },
        "artifacts": {
          "type": "array",
          "default": [],
          "items": {
            "$ref": "#/$defs/artifact"
          }
        },
        "actions": {
          "type": "array",
          "default": [],
          "items": {
            "$ref": "#/$defs/action_command"
          }
        }
      }
    }
  }
}
